{
  "$schema": "https://json-schema.org/draft/2020-12/schema",
  "$id": "https://github.com/sempervent/agent-llm-wiki-matrix/schemas/v1/rubric.schema.json",
  "title": "Rubric",
  "type": "object",
  "additionalProperties": false,
  "required": ["id", "title", "criteria"],
  "properties": {
    "id": { "type": "string", "minLength": 1 },
    "title": { "type": "string", "minLength": 1 },
    "version": { "type": "string", "default": "1" },
    "criteria": {
      "type": "array",
      "minItems": 1,
      "items": {
        "type": "object",
        "additionalProperties": false,
        "required": ["id", "weight"],
        "properties": {
          "id": { "type": "string", "minLength": 1 },
          "weight": { "type": "number", "minimum": 0 },
          "description": { "type": "string" }
        }
      }
    }
  }
}
